"Company","Address","More Info URL","Has DEQ Permit","Has Onsite Storage of Chemicals","DEQ General Permit Type","DEQ General Permit Display Type"
"Precision Equipment, Inc. ","8440 N KERBY AVE, PORTLAND, OR 97217","www.portlandcleanair.org/26-0051","Yes","Yes",1,"Other"
"Donaldson & Landry Machine Shop ","8916 NE VANCOUVER WAY, PORTLAND, OR 97211","www.portlandcleanair.org/26-9841","Yes","No",1,"Other"
"West Coast Wire Rope & Rigging, Inc. ","2900 NW 29TH AVE, PORTLAND, OR 97210","www.portlandcleanair.org/26-0067","Yes","Yes",5,"Other"
"K F Jacobsen & Co., Inc. ","1208 N RIVER ST, PORTLAND, OR 97227","www.portlandcleanair.org/26-1764","Yes","Yes",7,"Other"
"Porter W. Yett Company ","5949 NE CULLY BLVD, PORTLAND, OR 97218","www.portlandcleanair.org/26-1767","Yes","No",7,"Other"
"Lakeside Industries Front Avenue Fac.","4850 NW FRONT AVE, PORTLAND, OR 97240","www.portlandcleanair.org/26-3242","Yes","No",7,"Other"
"Lakeside Industries, Inc. 100th Ave-Foster  Road Asphalt Plant","6637 SE 100TH AVE, PORTLAND, OR 97266","www.portlandcleanair.org/26-3305","Yes","No",7,"Other"
"Environmentally Conscious Recycling, Inc ","12409 NE SAN RAFAEL ST, PORTLAND, OR 97230","www.portlandcleanair.org/26-0086","Yes","No",8,"Other"
"Lakeside Industries Front Avenue","4850 NW FRONT AVE, PORTLAND, OR 97240","www.portlandcleanair.org/26-0109","Yes","No",8,"Other"
"Porter W. Yett Company ","5949 NE CULLY BLVD, PORTLAND, OR 97218","www.portlandcleanair.org/26-0110","Yes","No",8,"Other"
"Morse Bros., Inc. dba Knife River Knife River Gresham Crusher","1339 NE EASTWOOD, GRESHAM, OR 97030","www.portlandcleanair.org/26-0129","Yes","No",8,"Other"
"Portland Sand & Gravel Company ","10717 SE DIVISION ST, PORTLAND, OR 97266","www.portlandcleanair.org/26-1917","Yes","No",8,"Other"
"Ross Island Sand & Gravel Co. Hardtack Island","HARDTACK ISLAND - WILLAMETTE RIVER, PORTLAND, OR 972HH","www.portlandcleanair.org/26-1941","Yes","No",8,"Other"
"Brooks Products Newcastle Precast","10404 NE MARX ST, PORTLAND, OR 97220","www.portlandcleanair.org/26-0052","Yes","Yes",9,"9"
"City of Portland Bureau of Water Works","1900 N INTERSTATE AVE, PORTLAND, OR 97227","www.portlandcleanair.org/26-0071","Yes","No",9,"9"
"Morse Bros., Inc. ","5700 NE SUNDIAL RD, TROUTDALE, OR 97060","www.portlandcleanair.org/26-0101","Yes","Yes",9,"9"
"Oldcastle Precast, Inc Oldcastle Precast - Portland","755 NE COLUMBIA BLVD, PORTLAND, OR 97211","www.portlandcleanair.org/26-0112","Yes","No",9,"9"
"Willamette Graystone, Inc. ","2405 NE 244TH AVE, WOOD VILLAGE, OR 97060","www.portlandcleanair.org/26-0253","Yes","No",9,"9"
"Troutdale Sand & Gravel Co. ","2205 NE 244TH, TROUTDALE, OR 97060","www.portlandcleanair.org/26-1939","Yes","No",9,"9"
"Ross Island Sand & Gravel Co. Vanport","1835 N MARINE DR, PORTLAND, OR 97217","www.portlandcleanair.org/26-1944","Yes","Yes",9,"9"
"Ross Island Sand & Gravel Co. Albina Ready Mix Plant","1208 N RIVER ST, PORTLAND, OR 97227","www.portlandcleanair.org/26-1946","Yes","Yes",9,"9"
"Glacier Northwest, Inc. NW Front","5034 NW FRONT AVE, PORTLAND, OR 97210","www.portlandcleanair.org/26-3265","Yes","Yes",9,"9"
"Pacific Rock Products, LLC dba CEMEX Swan Island Redi-Mix Plant","5225 N CHANNEL AVE, PORTLAND, OR 97217","www.portlandcleanair.org/26-9535","Yes","No",9,"9"
"Boden Store Fixtures, Inc. Plant #1","5335 NE 109TH AVE, PORTLAND, OR 97220","www.portlandcleanair.org/26-0041","Yes","No",10,"Other"
"Western Pacific Building Materials, Inc. ","2909 NW 31ST AVE, PORTLAND, OR 97210","www.portlandcleanair.org/26-0045","Yes","No",10,"Other"
"Pacific Architectural Wood Products, Inc. ","714 NE 55TH AVE, PORTLAND, OR 97213","www.portlandcleanair.org/26-0072","Yes","No",10,"Other"
"Blasen & Blasen Lumber Corp. ","2155 N COLUMBIA BLVD, PORTLAND, OR 97217","www.portlandcleanair.org/26-2557","Yes","No",10,"Other"
"L.W.O. Corporation ","3841 N COLUMBIA BLVD, PORTLAND, OR 97217","www.portlandcleanair.org/26-3130","Yes","Yes",10,"Other"
"Carl Diebold Lumber Co. ","725 NW DUNBAR, TROUTDALE, OR 97060","www.portlandcleanair.org/26-3243","Yes","No",10,"Other"
"Portland Adventist Medical Center ","10300 SE MAIN ST, PORTLAND, OR 97216","www.portlandcleanair.org/26-0010","Yes","No",11,"11"
"American Industrial Service Co. ","5225 SE 26TH AVE, PORTLAND, OR 97202","www.portlandcleanair.org/26-0011","Yes","Yes",11,"11"
"ARAMARK Uniform Services, Inc. ","1848 NW 23RD AVE, PORTLAND, OR 97210","www.portlandcleanair.org/26-0092","Yes","Yes",11,"11"
"Exxonmobil Oil Corporation Lube Plant","9420 NW SAINT HELENS RD, PORTLAND, OR 97231","www.portlandcleanair.org/26-0113","Yes","No",11,"11"
"Swan Island Dairy ","4950 N BASIN AVE, PORTLAND, OR 97217","www.portlandcleanair.org/26-0141","Yes","Yes",11,"11"
"Portland State University ","630 SW Mill St, PORTLAND, OR 97207","www.portlandcleanair.org/26-0241","Yes","No",11,"11"
"Legacy Health Systems, Holladay Park Medical Center ","1225 NE 2ND AVE, PORTLAND, OR 97232","www.portlandcleanair.org/26-1799","Yes","No",11,"11"
"Legacy Emanuel Hospital & Health Center ","2801 N GANTENBEIN AVE, PORTLAND, OR 97227","www.portlandcleanair.org/26-1803","Yes","No",11,"11"
"Providence Portland Medical Center ","4805 NE GLISAN ST, PORTLAND, OR 97213","www.portlandcleanair.org/26-1804","Yes","No",11,"11"
"Marquis Care at Mt. Tabor ","6040 SE BELMONT ST, PORTLAND, OR 97215","www.portlandcleanair.org/26-2210","Yes","No",11,"11"
"CAPREF Lloyd Center LLC ","2201 LLOYD CTR, PORTLAND, OR 97232","www.portlandcleanair.org/26-2400","Yes","No",11,"11"
"David Douglas Sr Hs Bldg ","1500 SE 130TH AVE, PORTLAND, OR 97233","www.portlandcleanair.org/26-2426","Yes","No",11,"11"
"American Linen ","1441 N COLUMBIA BLVD, PORTLAND, OR 97217","www.portlandcleanair.org/26-2579","Yes","Yes",11,"11"
"Benson High School ","546 NE 12TH AVE, PORTLAND, OR 97232","www.portlandcleanair.org/26-2713","Yes","Yes",11,"11"
"Lewis & Clark College ","0615 SW PALATINE HILL RD, PORTLAND, OR 97219","www.portlandcleanair.org/26-2778","Yes","Yes",11,"11"
"The Reed Institute ","3203 SE WOODSTOCK BLVD, PORTLAND, OR 97202","www.portlandcleanair.org/26-2784","Yes","Yes",11,"11"
"Legacy Good Samaritan Hospital and Medical Center ","1015 NW 22ND AVE, PORTLAND, OR 97210","www.portlandcleanair.org/26-2926","Yes","No",11,"11"
"Portland Community College Sylvania Campus","12000 SW 49TH AVE, PORTLAND, OR 97219","www.portlandcleanair.org/26-2971","Yes","Yes",11,"11"
"Darigold, Inc. ","2720 SE 6TH AVE, PORTLAND, OR 97202","www.portlandcleanair.org/26-3253","Yes","Yes",11,"11"
"Oregon Health Sciences University ","3181 SW SAM JACKSON PARK RD, PORTLAND, OR 97239","www.portlandcleanair.org/26-0042","Yes","No",12,"12"
"Omega Cremation & Burial Service, Inc. ","223 SE 122ND AVE, PORTLAND, OR 97233","www.portlandcleanair.org/26-0125","Yes","No",12,"12"
"Portland Cremation Center, LLC ","17819 NE Riverside Pkwy Ste A, Portland, OR 97230","www.portlandcleanair.org/26-0151","Yes","No",12,"12"
"Family Animal Services, Inc. Riverside Parkway","17819 NE Riverside Pkwy Ste B, Portland, OR 97230","www.portlandcleanair.org/26-0155","Yes","No",12,"12"
"Oregon Humane Society ","1067 NE COLUMBIA BLVD, PORTLAND, OR 97211","www.portlandcleanair.org/26-2052","Yes","No",12,"12"
"Riverview Abbey Mausoleum Co. ","0319 SW TAYLORS FERRY RD, PORTLAND, OR 97219","www.portlandcleanair.org/26-2545","Yes","No",12,"12"
"Portland Memorial Inc ","6705 SE 14TH AVE, PORTLAND, OR 97202","www.portlandcleanair.org/26-2949","Yes","No",12,"12"
"Multnomah County Animal Control","24450 W COLUMBIA, TROUTDALE, OR 97060","www.portlandcleanair.org/26-2960","Yes","No",12,"12"
"SCI, Uniservice Corporation PFS Crematory","4733 NE THOMPSON, PORTLAND, OR 97213","www.portlandcleanair.org/26-3091","Yes","No",12,"12"
"Alderwoods Group Bateman Carroll Crematory","520 W BLVD POWELL, GRESHAM, OR 97030","www.portlandcleanair.org/26-3131","Yes","No",12,"12"
"River View Cemetary Association The ","0300 SW TAYLORS FERRY, PORTLAND, OR 97219","www.portlandcleanair.org/26-3276","Yes","No",12,"12"
"First Call Mortuary Service Inc ","4835 NE PACIFIC ST, PORTLAND, OR 97213","www.portlandcleanair.org/26-9545","Yes","No",12,"12"
"Cereal Food Processors, Inc. ","N LOMBARD ST FOOT OF, PORTLAND, OR 97203","www.portlandcleanair.org/26-2013","Yes","No",14,"Other"
"Land O'Lakes Purina Feed LLC ","15840 N SIMMONS RD, PORTLAND, OR 97203","www.portlandcleanair.org/26-3062","Yes","Yes",14,"Other"
"Wilbur-Ellis Company ","9945 N Burgard Way, Portland, OR 97203","www.portlandcleanair.org/26-3217","Yes","No",14,"Other"
"K & F Select Fine Coffees ","2801 SE 14TH AVENUE, PORTLAND, OR 97202","www.portlandcleanair.org/26-0004","Yes","No",16,"16"
"Kobos Company (The) ","2355 NW VAUGHN ST, PORTLAND, OR 97210","www.portlandcleanair.org/26-0007","Yes","No",16,"16"
"Portland Roasting Company ","340 SE 7TH AVE, PORTLAND, OR 97214","www.portlandcleanair.org/26-0070","Yes","No",16,"16"
"Brazilian Specialty Coffees, LLC ","1319 NW JOHNSON ST, PORTLAND, OR 97209","www.portlandcleanair.org/26-0224","Yes","No",16,"16"
"STUMPTOWN COFFEE CORP ","119 SE MAIN , PORTLAND, OR 97214","www.portlandcleanair.org/26-0227","Yes","No",16,"16"
"Black Rock Roasting Company Black Rock Warehouse","16307 NE CAMERON BLVD, PORTLAND, OR 97230","www.portlandcleanair.org/26-0239","Yes","No",16,"16"
"Bridgetown Coffee Company ","2101 NW YORK ST, PORTLAND, OR 97210","www.portlandcleanair.org/26-0261","Yes","No",16,"16"
"Heart LLC dba Heart Roasters","923 SE HAWTHORNE BLVD, PORTLAND, OR 97214","www.portlandcleanair.org/26-0263","Yes","No",16,"16"
"Boyd Coffee Company ","19730 NE SANDY BLVD, PORTLAND, OR 97230","www.portlandcleanair.org/26-2477","Yes","Yes",16,"16"
"Coffee Bean International, Inc. ","9120 NE ALDERWOOD RD, PORTLAND, OR 97220","www.portlandcleanair.org/26-3088","Yes","No",16,"16"
"Tyree Oil, Inc. ","2429 N BORTHWICK AVE, PORTLAND, OR 97227","www.portlandcleanair.org/26-3075","Yes","No",17,"Other"
"Tata Communications (US) Inc. ","1225 W BURNSIDE ST, PORTLAND, OR 97209","www.portlandcleanair.org/26-0040","Yes","No",18,"18"
"PCC Structurals LBO power generator","4600 SE HARNEY DR, PORTLAND, OR 97206","www.portlandcleanair.org/26-0130","Yes","Yes",18,"18"
"SunGard Availability Services, LP ","1233 NW 12TH AVE, PORTLAND, OR 97209","www.portlandcleanair.org/26-0132","Yes","No",18,"18"
"Skyline Tower, LLC KGW","1501 SW JEFFERSON ST, PORTLAND, OR 97201","www.portlandcleanair.org/26-0133","Yes","No",18,"18"
"Providence Health & Services - Oregon dba Providence Portland Medical Center","4805 NE GLISAN ST, PORTLAND, OR 97213","www.portlandcleanair.org/26-0136","Yes","No",18,"18"
"City of Portland, Bureau of Environmental Services Columbia Boulevard Wastewater Treatment Plant","5001 N. COLUMBIA BLVD., PORTLAND, OR 97203","www.portlandcleanair.org/26-0172","Yes","No",18,"18"
"Multnomah County East County Courthouse","18480 SE STARK ST, GRESHAM, OR 97223","www.portlandcleanair.org/26-0229","Yes","No",18,"18"
"Multnomah County Facilities & Prop. Mng. ","14355 N BYBEE LAKE CT, PORTLAND, OR 97203","www.portlandcleanair.org/26-0243","Yes","No",18,"18"
"Multnomah County Facilities & Prop. Mng. ","1401 NE 68TH AVE, PORTLAND, OR 97213","www.portlandcleanair.org/26-0244","Yes","No",18,"18"
"MEMC Electronic Materials, Inc. Portland, Oregon Manufacturing","7832 N LEADBETTER RD, PORTLAND, OR 97203","www.portlandcleanair.org/26-9536","Yes","Yes",18,"18"
"Pratt and Larson Ceramics ","1201 SE 3RD AVE, PORTLAND, OR 97214","www.portlandcleanair.org/26-9548","Yes","Yes",19,"Other"
"Kohler Company Ann Sacks Tile","8120 NE 33RD DR, PORTLAND, OR 97211","www.portlandcleanair.org/26-9801","Yes","Yes",19,"Other"
"Northwest Copper Works, Inc. ","1303 N RIVER ST, PORTLAND, OR 97227","www.portlandcleanair.org/26-0168","Yes","No",25,"Other"
"Sulzer Pumps (US), Inc. ","2800 NW FRONT AVE, PORTLAND, OR 97210","www.portlandcleanair.org/26-0178","Yes","Yes",25,"Other"
"Rikar Enterprises Inc. Pioneer Trailer and Fabrication","7559 NE 33RD DRIVE, PORTLAND, OR 97211","www.portlandcleanair.org/26-0179","Yes","No",25,"Other"
"American Metal Products Company AMPCO","1532 SE 3RD AVENUE, PORTLAND, OR 97214","www.portlandcleanair.org/26-0184","Yes","No",25,"Other"
"CH Murphy/Clark-Ulman, Inc. ","5565 N DOLPHIN ST, PORTLAND, OR 97217","www.portlandcleanair.org/26-0187","Yes","No",25,"Other"
"Transco Industries, Inc. ","5534 NE 122ND AVE, PORTLAND, OR 97230","www.portlandcleanair.org/26-0218","Yes","No",25,"Other"
"The Lynch Company, Inc. ","4706 SE 18TH AVE, PORTLAND, OR 97202","www.portlandcleanair.org/26-0251","Yes","No",25,"Other"
"East Side Plating, Inc. Plant #4","310 SE STEPHENS ST, PORTLAND, OR 97214","www.portlandcleanair.org/26-0171","Yes","Yes",26,"Other"
"Apex Anodizing, Inc. Apex Anodizing, Inc.","7116 SE 92ND AVE, PORTLAND, OR 97266","www.portlandcleanair.org/26-0189","Yes","Yes",26,"Other"
"Bob Thomas Auto Body ","8752 NE SANDY BLVD, PORTLAND, OR 97220","www.portlandcleanair.org/26-0159","Yes","No",27,"27"
"Brasher's Auto and Truck Collision Repair ","23585 NE SANDY BLVD, WOOD VILLAGE, OR 97060","www.portlandcleanair.org/26-0161","Yes","No",27,"27"
"U-Haul Repair Center ","11711 SE 82ND AVE, PORTLAND, OR 97266","www.portlandcleanair.org/26-0164","Yes","No",27,"27"
"K W Auto Body, Inc. dba Si's Auto Body","6708 NE GLISAN, PORTLAND, OR 97213","www.portlandcleanair.org/26-0165","Yes","No",27,"27"
"Columbia Sales and Service, Inc. ","8500 N COLUMBIA BLVD, PORTLAND, OR 97203","www.portlandcleanair.org/26-0173","Yes","No",27,"27"
"Sharp Auto Body and Paint Works, Inc. ","4031 SE 26TH, PORTLAND, OR 97202","www.portlandcleanair.org/26-0174","Yes","No",27,"27"
"Gateway Body Shop, Inc. ","1418 NE 119TH AVE, PORTLAND, OR 97220","www.portlandcleanair.org/26-0175","Yes","No",27,"27"
"Tom Black's Garage ","2400 NE HOLLADAY ST, PORTLAND, OR 97232","www.portlandcleanair.org/26-0185","Yes","No",27,"27"
"East Portland Auto Body, Inc. ","9127 SE STARK ST, PORTLAND, OR 97216","www.portlandcleanair.org/26-0186","Yes","No",27,"27"
"Central Auto Body LLC dba John's Landing Auto Body","6805 SW MACADAM AVE, PORTLAND, OR 97219","www.portlandcleanair.org/26-0188","Yes","No",27,"27"
"Jose Sanchez Jose's Auto Body","10510 SE REEDWAY ST, PORTLAND, OR 97266","www.portlandcleanair.org/26-0191","Yes","No",27,"27"
"Thompson Auto Body, Inc. ","10310 SE FOSTER RD, PORTLAND, OR 97266","www.portlandcleanair.org/26-0194","Yes","No",27,"27"
"ACP Auto Body LLC ","10033 E BURNSIDE ST, PORTLAND, OR 97216","www.portlandcleanair.org/26-0196","Yes","No",27,"27"
"Express Auto Body, Inc. ","801 N LOMBARD ST, PORTLAND, OR 97217","www.portlandcleanair.org/26-0205","Yes","No",27,"27"
"Fix Auto Express Gresham ","1300 NE DIVISION ST, GRESHAM, OR 97030","www.portlandcleanair.org/26-0209","Yes","No",27,"27"
"ACME Welding, Inc. ","637 SE SALMON ST, PORTLAND, OR 97214","www.portlandcleanair.org/26-0211","Yes","No",27,"27"
"Portland Auto LLC ","10000 SE ANKENY ST, PORTLAND, OR 97216","www.portlandcleanair.org/26-0212","Yes","No",27,"27"
"Elite Collision LLC ","1925 E POWELL BLVD, GRESHAM, OR 97080","www.portlandcleanair.org/26-0216","Yes","No",27,"27"
"Quality Industrial Refinishers Co. ","901 NE GERTZ RD, PORTLAND, OR 97211","www.portlandcleanair.org/26-0217","Yes","No",27,"27"
"Vanquish Investment Group Pacific Service Center","4030 NE BUFFALO ST, PORTLAND, OR 97211","www.portlandcleanair.org/26-0219","Yes","No",27,"27"
"Horizon Air Industries ","8070 NE AIRTRANS WAY, PORTLAND, OR 97218","www.portlandcleanair.org/26-0248","Yes","Yes",27,"27"
"Manheim Portland Manheim","3000 N HAYDEN ISLAND DR, PORTLAND, OR 97217","www.portlandcleanair.org/26-9546","Yes","No",27,"27"
"Timby's Too LLC Timby's Dipstrip","7510 N DELAWARE AVE, PORTLAND, OR 97217","www.portlandcleanair.org/26-0232","Yes","No",28,"Other"
"Aarons Custom Metal Fab, Inc. ","4709 NE 148TH AVE, PORTLAND, OR 97230","www.portlandcleanair.org/26-0167","Yes","No",29,"Other"
"Metal Enterprises, Inc. ","2425 NW 23RD PL, PORTLAND, OR 97210","www.portlandcleanair.org/26-0197","Yes","No",29,"Other"
"EVRAZ Inc, NA ","14400 N RIVERGATE BLVD, PORTLAND, OR 97203","www.portlandcleanair.org/26-1865","Yes","Yes",31,"31"
"Owens-Brockway Glass Container Inc. ","9710 NE Glass Plant Road, PORTLAND, OR 97220","www.portlandcleanair.org/26-1876","Yes","No",31,"31"
"Arc Terminals Holdings, LLC Willbridge Asphalt Refinery","5501 NW FRONT AVE, PORTLAND, OR 97210","www.portlandcleanair.org/26-2025","Yes","No",31,"31"
"Chevron Products Company ","5531 NW DOANE AVE, PORTLAND, OR 97210","www.portlandcleanair.org/26-2027","Yes","No",31,"31"
"Kinder Morgan Liquids Terminals LLC Willbridge Terminal","5880 NW ST HELENS RD, PORTLAND, OR 97210","www.portlandcleanair.org/26-2028","Yes","No",31,"31"
"Shore Terminals LLC Nustar","9420 NW SAINT HELENS RD, PORTLAND, OR 97231","www.portlandcleanair.org/26-2029","Yes","No",31,"31"
"BP West Coast Products, LLC ","9930 NW SAINT HELENS RD, PORTLAND, OR 97231","www.portlandcleanair.org/26-2030","Yes","No",31,"31"
"Oregon Health Sciences University ","3181 SW SAM JACKSON PARK RD, PORTLAND, OR 97239","www.portlandcleanair.org/26-2050","Yes","No",31,"31"
"ESCO Corporation ","2141 NW 25TH AVE, PORTLAND, OR 97210","www.portlandcleanair.org/26-2068","Yes","Yes",31,"31"
"Daimler Trucks North America, LLC Western Star Truck Plant Portland","6936 N FATHOM ST, PORTLAND, OR 97217","www.portlandcleanair.org/26-2197","Yes","Yes",31,"31"
"Northwest Pipe Company ","12005 N BURGARD WAY, PORTLAND, OR 97203","www.portlandcleanair.org/26-2492","Yes","Yes",31,"31"
"Graphic Packaging International, Inc ","3400 N MARINE DR, PORTLAND, OR 97217","www.portlandcleanair.org/26-2777","Yes","Yes",31,"31"
"Gunderson LLC ","4700 NW FRONT AVE, PORTLAND, OR 97210","www.portlandcleanair.org/26-2944","Yes","No",31,"31"
"Arclin Surfaces, Inc. Portland Operations","2301 N COLUMBIA BLVD, PORTLAND, OR 97217","www.portlandcleanair.org/26-3009","Yes","Yes",31,"31"
"Owens Corning Roofing and Asphalt, LLC ","11910 NW SAINT HELENS RD, PORTLAND, OR 97231","www.portlandcleanair.org/26-3067","Yes","No",31,"31"
"Vigor Industrial, LLC ","5555 N CHANNEL AVE BLDG 71, PORTLAND, OR 97217","www.portlandcleanair.org/26-3224","Yes","No",31,"31"
"Metropolitan Service District St Johns Landfill","9363 N COLUMBIA BLVD, PORTLAND, OR 97203","www.portlandcleanair.org/26-3310","Yes","No",31,"31"
"Owens Corning Foam Insulation, LLC Owens Corning-Gresham Plant","18456 NE WILKES RD, GRESHAM, OR 97230","www.portlandcleanair.org/26-9537","Yes","No",31,"31"
"Rodda Paint Co. ","6123 N MARINE DR, PORTLAND, OR 97203","www.portlandcleanair.org/26-0026","Yes","No",32,"32"
"SemiConductor Components Industries, LLC ON Semiconductor","23400 NE GLISAN ST, GRESHAM, OR 97030","www.portlandcleanair.org/26-0027","Yes","Yes",32,"32"
"Columbia Structural Tubing Inc. Evraz Oregon Steel Structural Tubing","8735 N HARBORGATE ST, PORTLAND, OR 97203","www.portlandcleanair.org/26-0054","Yes","Yes",32,"32"
"City of Portland,Bureau of Environmental Columbia Blvd WWTP","5001 N. COLUMBIA BLVD., PORTLAND, OR 97203","www.portlandcleanair.org/26-0100","Yes","No",32,"32"
"Bushwacker, Inc. ","9269 N BRADFORD ST, PORTLAND, OR 97203","www.portlandcleanair.org/26-0123","Yes","No",32,"32"
"Waste Management of Oregon, Inc. WM Agilyx Wastech","701 N HUNT ST, PORTLAND, OR 97217","www.portlandcleanair.org/26-0170","Yes","No",32,"32"
"Troutdale Energy Center LLC Troutdale Energy Center","TROUTDALE REYNOLDS INDUSTRIAL PK LOT 3, TOUTDALE, OR 97060","www.portlandcleanair.org/26-0235","Yes","No",32,"32"
"Solenis LLC ","3366 NW YEON AVE, PORTLAND, OR 97210","www.portlandcleanair.org/26-1814","Yes","Yes",32,"32"
"Owens Corning Roofing and Asphalt, LLC Trumbull Asphalt","3750 NW YEON AVE, PORTLAND, OR 97210","www.portlandcleanair.org/26-1815","Yes","No",32,"32"
"PCC Structurals, Inc. ","4600 SE HARNEY DR, PORTLAND, OR 97206","www.portlandcleanair.org/26-1867","Yes","Yes",32,"32"
"Columbia Steel Casting Co Inc. ","10425 N BLOSS AVE, PORTLAND, OR 97203","www.portlandcleanair.org/26-1869","Yes","Yes",32,"32"
"J. R. Simplot Company Rivergate Terminal","14003 N RIVERGATE BLVD, PORTLAND, OR 97203","www.portlandcleanair.org/26-1889","Yes","Yes",32,"32"
"Ash Grove Cement Company ","13939 N RIVERGATE BLVD, PORTLAND, OR 97203","www.portlandcleanair.org/26-1891","Yes","Yes",32,"32"
"R. R. Donnelley Norwest, Inc. ","17401 NE HALSEY ST, PORTLAND, OR 97230","www.portlandcleanair.org/26-1892","Yes","No",32,"32"
"Herbert Malarkey Roofing Company ","3131 N COLUMBIA BLVD, PORTLAND, OR 97217","www.portlandcleanair.org/26-1894","Yes","Yes",32,"32"
"LD Commodities, Northwest Facility, LLC O'Dock - Facility","900 N THUNDERBIRD WAY, PORTLAND, OR 97227","www.portlandcleanair.org/26-2000","Yes","Yes",32,"32"
"Temco, LLC A Limited Liability Company of Delaware ","800 N RIVER ST., PORTLAND, OR 97227","www.portlandcleanair.org/26-2003","Yes","No",32,"32"
"Phillips 66 Company Phillips 66 Portland Terminal","5528 NW DOANE AVE, PORTLAND, OR 97210","www.portlandcleanair.org/26-2026","Yes","No",32,"32"
"CertainTeed Corporation ","6350 NW FRONT AVE, PORTLAND, OR 97210","www.portlandcleanair.org/26-2043","Yes","Yes",32,"32"
"Boeing Company (The) ","19000 NE SANDY BLVD, PORTLAND, OR 97230","www.portlandcleanair.org/26-2204","Yes","Yes",32,"32"
"Equilon Enterprises LLC dba Shell Oil Products US","3800 NW ST HELENS RD, PORTLAND, OR 97210","www.portlandcleanair.org/26-2478","Yes","No",32,"32"
"Container Management Services, LLC ","3000 NW SAINT HELENS RD, PORTLAND, OR 97210","www.portlandcleanair.org/26-2572","Yes","No",32,"32"
"Columbia Export Terminal, LLC ","15660 N LOMBARD ST, PORTLAND, OR 97203","www.portlandcleanair.org/26-2807","Yes","Yes",32,"32"
"Kinder Morgan Bulk Terminals, Inc. Terminal 4 - Pier 4","11040 N LOMBARD ST, PORTLAND, OR 97203","www.portlandcleanair.org/26-2909","Yes","Yes",32,"32"
"Port Of Portland Portland Intl Airport","7320 NE AIRPORT WAY, PORTLAND, OR 97218","www.portlandcleanair.org/26-2914","Yes","Yes",32,"32"
"Cenveo Corporation Graphic Arts Center","2000 NW WILSON ST, PORTLAND, OR 97209","www.portlandcleanair.org/26-2931","Yes","Yes",32,"32"
"United States Bakery Franz Bakery Portland","340 NE 11TH AVE, PORTLAND, OR 97232","www.portlandcleanair.org/26-2952","Yes","No",32,"32"
"Mondelez Global LLC ","100 NE COLUMBIA BLVD, PORTLAND, OR 97211","www.portlandcleanair.org/26-2968","Yes","Yes",32,"32"
"Siltronic Corporation ","7200 NW FRONT AVE, PORTLAND, OR 97210","www.portlandcleanair.org/26-3002","Yes","Yes",32,"32"
"American Petroleum Environmental Services, Inc. ","11535 N FORCE AVE, PORTLAND, OR 97217","www.portlandcleanair.org/26-3021","Yes","No",32,"32"
"Myers Containers, LLC ","8435 NE KILLINGSWORTH ST, PORTLAND, OR 97220","www.portlandcleanair.org/26-3035","Yes","No",32,"32"
"Cascade Corporation ","2201 NE 201ST AVE, FAIRVIEW, OR 97024","www.portlandcleanair.org/26-3038","Yes","No",32,"32"
"Oregonian Publishing Co. ","1621 SW TAYLOR, PORTLAND, OR 97205","www.portlandcleanair.org/26-3045","Yes","Yes",32,"32"
"Oil Re-Refining Company Inc. ","4150 N SUTTLE RD, PORTLAND, OR 97217","www.portlandcleanair.org/26-3048","Yes","Yes",32,"32"
"QG Printing II Corp. ","6031 NE 92ND DR, PORTLAND, OR 97220","www.portlandcleanair.org/26-3110","Yes","Yes",32,"32"
"Bullseye Glass Co. ","3722 SE 21ST AVE, PORTLAND, OR 97202","www.portlandcleanair.org/26-3135","Yes","No",32,"32"
"Microchip Technology, Inc. ","21015 SE STARK ST, GRESHAM, OR 97030","www.portlandcleanair.org/26-3240","Yes","Yes",32,"32"
"Sapa, Inc. ","5325 NE SKYPORT WAY, PORTLAND, OR 97218","www.portlandcleanair.org/26-3241","Yes","Yes",32,"32"
"Oregon Air National Guard ","6801 NE CORNFOOT RD, PORTLAND, OR 97218","www.portlandcleanair.org/26-3254","Yes","Yes",32,"32"
"Boeing Company Boeing PDX","4635 NE CORNFOOT RD, PORTLAND, OR 97218","www.portlandcleanair.org/26-3291","Yes","No",32,"32"
"Canron Western Constructors, Inc. ","4600 NE 138TH AVE, PORTLAND, OR 97230","www.portlandcleanair.org/26-3311","Yes","No",32,"32"
"Silver Eagle Manufacturing Co. ","5825 NE SKYPORT WAY, PORTLAND, OR 97218","www.portlandcleanair.org/26-3317","Yes","Yes",32,"32"
"CBG Portland, LLC ","6849 NE COLUMBIA BLVD, PORTLAND, OR 97218","www.portlandcleanair.org/26-9820","Yes","No",32,"32"
"Flint Group North America Flint Ink","2985 N MARINE DR, PORTLAND, OR 97217","www.portlandcleanair.org/26-0076","Yes","Yes",33,"33"
"Mutual Materials Company ","2300 SE HOGAN ROAD, GRESHAM, OR 97080","www.portlandcleanair.org/26-0088","Yes","No",33,"33"
"Journal Graphics, Inc. ","2840 NW 35TH AVE, PORTLAND, OR 97210","www.portlandcleanair.org/26-0103","Yes","Yes",33,"33"
"Pierce Pacific Manufacturing ","4424 NE 158TH AVE, PORTLAND, OR 97230","www.portlandcleanair.org/26-0143","Yes","Yes",33,"33"
"Ash Grove Cement Company Cement Distribution Ctr","3737 N PORT CENTER WAY, PORTLAND, OR 97217","www.portlandcleanair.org/26-0146","Yes","Yes",33,"33"
"EZFlow, Limited Partnership ","3004 N Wygant St, Portland, OR 97217","www.portlandcleanair.org/26-0157","Yes","No",33,"33"
"SoloPower, Inc. ","6308 N. MARINE DRIVE, PORTLAND, OR 97203","www.portlandcleanair.org/26-0207","Yes","No",33,"33"
"Morgan Truck Body LLC Morgan Corporation","4436 NE 158TH AVE, PORTLAND, OR 97230","www.portlandcleanair.org/26-0236","Yes","Yes",33,"33"
"Rose City Printing and Publishing, Inc. Rose City Printing and Packaging","18683 NE SANDY BLVD, GRESHAM, OR 97230","www.portlandcleanair.org/26-0238","Yes","No",33,"33"
"Glass to Glass LLC ECOI","866 N COLUMBIA BLVD, PORTLAND, OR 97217","www.portlandcleanair.org/26-0242","Yes","No",33,"33"
"Galvanizers Company ","2406 NW 30TH AVE, PORTLAND, OR 97210","www.portlandcleanair.org/26-1885","Yes","Yes",33,"33"
"Supreme Perlite Company ","4600 N SUTTLE RD, PORTLAND, OR 97217","www.portlandcleanair.org/26-2390","Yes","No",33,"33"
"Cardinal Aluminum ","6800 NE 59TH PL, PORTLAND, OR 97218","www.portlandcleanair.org/26-2435","Yes","Yes",33,"33"
"Eco Services Operations, LLC ","4429 N SUTTLE RD, PORTLAND, OR 97217","www.portlandcleanair.org/26-2548","Yes","Yes",33,"33"
