"company_name","address","key","in_deq","in_storage","in_deq_cao"
"Precision Equipment, Inc. ","8440 N Kerby Ave, Portland, OR 97217, USA","26-0051",1,1,NA
"Donaldson & Landry Machine Shop ","8916 NE Vancouver Way, Portland, OR 97211, USA","26-9841",1,1,NA
"West Coast Wire Rope & Rigging, Inc. ","2900 NW 29th Ave, Portland, OR 97210, USA","26-0067",1,1,NA
"K F Jacobsen & Co., Inc. ","1208 N River St, Portland, OR 97227, USA","26-1764",1,1,NA
"Porter W. Yett Company ","5949 NE Cully Blvd, Portland, OR 97218, USA","26-1767",1,NA,NA
"Lakeside Industries Front Avenue Fac.","4850 NW Front Ave, Portland, OR 97210, USA","26-3242",1,1,NA
"Lakeside Industries, Inc. 100th Ave-Foster  Road Asphalt Plant","6637 SE 100th Ave, Portland, OR 97266, USA","26-3305",1,NA,NA
"Environmentally Conscious Recycling, Inc ","12409 NE San Rafael St, Portland, OR 97230, USA","26-0086",1,1,NA
"Lakeside Industries Front Avenue","4850 NW Front Ave, Portland, OR 97210, USA","26-0109",1,1,NA
"Porter W. Yett Company ","5949 NE Cully Blvd, Portland, OR 97218, USA","26-0110",1,NA,NA
"Morse Bros., Inc. dba Knife River Knife River Gresham Crusher","1339 NW Eastwood Ave, Gresham, OR 97030, USA","26-0129",1,1,NA
"Portland Sand & Gravel Company ","10717 SE Division St, Portland, OR 97266, USA","26-1917",1,NA,NA
"Ross Island Sand & Gravel Co. Hardtack Island","Hardtack Island, Portland, OR 97202, USA","26-1941",1,NA,NA
"Brooks Products Newcastle Precast","10404 NE Marx St, Portland, OR 97220, USA","26-0052",1,1,NA
"City of Portland Bureau of Water Works","1900 N Interstate Ave, Portland, OR 97227, USA","26-0071",1,NA,NA
"Morse Bros., Inc. ","5700 NE Sundial Rd, Troutdale, OR 97060, USA","26-0101",1,1,NA
"Oldcastle Precast, Inc Oldcastle Precast - Portland","755 NE Columbia Blvd, Portland, OR 97211, USA","26-0112",1,NA,NA
"Willamette Graystone, Inc. ","2405 NE 244th Ave, Wood Village, OR 97060, USA","26-0253",1,1,NA
"Troutdale Sand & Gravel Co. ","2205 NE 244th Ave, Wood Village, OR 97060, USA","26-1939",1,NA,NA
"Ross Island Sand & Gravel Co. Vanport","1835 N Marine Dr, Portland, OR 97217, USA","26-1944",1,1,NA
"Ross Island Sand & Gravel Co. Albina Ready Mix Plant","1208 N River St, Portland, OR 97227, USA","26-1946",1,1,NA
"Glacier Northwest, Inc. NW Front","5034 NW Front Ave, Portland, OR 97210, USA","26-3265",1,1,NA
"Pacific Rock Products, LLC dba CEMEX Swan Island Redi-Mix Plant","5225 N Channel Ave, Portland, OR 97217, USA","26-9535",1,NA,NA
"Boden Store Fixtures, Inc. Plant #1","5335 NE 109th Ave, Portland, OR 97220, USA","26-0041",1,NA,NA
"Western Pacific Building Materials, Inc. ","2909 NW 31st Ave, Portland, OR 97210, USA","26-0045",1,NA,NA
"Pacific Architectural Wood Products, Inc. ","714 NE 55th Ave, Portland, OR 97213, USA","26-0072",1,NA,NA
"Blasen & Blasen Lumber Corp. ","2155 N Columbia Blvd, Portland, OR 97217, USA","26-2557",1,NA,1
"L.W.O. Corporation ","3841 N Columbia Blvd, Portland, OR 97217, USA","26-3130",1,NA,NA
"Carl Diebold Lumber Co. ","725 NW Dunbar Ave, Troutdale, OR 97060, USA","26-3243",1,NA,NA
"Portland Adventist Medical Center ","10300 SE Main St, Portland, OR 97216, USA","26-0010",1,NA,NA
"American Industrial Service Co. ","5225 SE 26th Ave, Portland, OR 97202, USA","26-0011",1,1,NA
"ARAMARK Uniform Services, Inc. ","1848 NW 23rd Ave, Portland, OR 97210, USA","26-0092",1,1,NA
"Exxonmobil Oil Corporation Lube Plant","9420 NW St Helens Rd, Portland, OR 97231, USA","26-0113",1,NA,NA
"Swan Island Dairy ","4950 N Basin Ave, Portland, OR 97217, USA","26-0141",1,1,NA
"Portland State University ","630 SW Mill St, Portland, OR 97201, USA","26-0241",1,NA,NA
"Legacy Health Systems, Holladay Park Medical Center ","1225 NE 2nd Ave, Portland, OR 97232, USA","26-1799",1,NA,NA
"Legacy Emanuel Hospital & Health Center ","2801 N Gantenbein Ave, Portland, OR 97227, USA","26-1803",1,NA,NA
"Providence Portland Medical Center ","4805 NE Glisan St, Portland, OR 97213, USA","26-1804",1,1,NA
"Marquis Care at Mt. Tabor ","6040 SE Belmont St, Portland, OR 97215, USA","26-2210",1,NA,NA
"CAPREF Lloyd Center LLC ","2201 Lloyd Center, Portland, OR 97232, USA","26-2400",1,NA,NA
"David Douglas Sr Hs Bldg ","1500 SE 130th Ave, Portland, OR 97233, USA","26-2426",1,NA,NA
"American Linen ","1441 N Columbia Blvd, Portland, OR 97217, USA","26-2579",1,1,NA
"Benson High School ","546 NE 12th Ave, Portland, OR 97232, USA","26-2713",1,1,NA
"Lewis & Clark College ","0615 SW Palatine Hill Rd, Portland, OR 97219, USA","26-2778",1,1,NA
"The Reed Institute ","3203 SE Woodstock Blvd, Portland, OR 97202, USA","26-2784",1,1,NA
"Legacy Good Samaritan Hospital and Medical Center ","1015 NW 22nd Ave, Portland, OR 97210, USA","26-2926",1,1,NA
"Portland Community College Sylvania Campus","12000 SW 49th Ave, Portland, OR 97219, USA","26-2971",1,1,NA
"Darigold, Inc. ","2720 SE 6th Ave, Portland, OR 97202, USA","26-3253",1,1,NA
"Oregon Health Sciences University ","3181 SW Sam Jackson Park Rd, Portland, OR 97239, USA","26-0042",1,1,NA
"Omega Cremation & Burial Service, Inc. ","223 SE 122nd Ave, Portland, OR 97233, USA","26-0125",1,NA,NA
"Portland Cremation Center, LLC ","17819 NE Riverside Pkwy Ste A, Portland, OR 97230, USA","26-0151",1,NA,NA
"Family Animal Services, Inc. Riverside Parkway","17819 NE Riverside Pkwy Ste B, Portland, OR 97230, USA","26-0155",1,NA,NA
"Oregon Humane Society ","1067 NE Columbia Blvd, Portland, OR 97211, USA","26-2052",1,NA,NA
"Riverview Abbey Mausoleum Co. ","0319 SW Taylors Ferry Rd, Portland, OR 97219, USA","26-2545",1,NA,NA
"Portland Memorial Inc ","6705 SE 14th Ave, Portland, OR 97202, USA","26-2949",1,NA,NA
"Multnomah County Animal Control","107 E Historic Columbia River Hwy, Troutdale, OR 97060, USA","26-2960",1,NA,NA
"SCI, Uniservice Corporation PFS Crematory","4733 NE Thompson St, Portland, OR 97213, USA","26-3091",1,NA,NA
"Alderwoods Group Bateman Carroll Crematory","520 Powell Blvd, Gresham, OR 97030, USA","26-3131",1,NA,NA
"River View Cemetary Association The ","300 SW Taylors Ferry Rd, Portland, OR 97219, USA","26-3276",1,NA,NA
"First Call Mortuary Service Inc ","4835 Northeast Pacific Street, Portland, OR 97213, USA","26-9545",1,NA,NA
"Cereal Food Processors, Inc. ","N Lombard St, Portland, OR 97203, USA","26-2013",1,NA,NA
"Land O'Lakes Purina Feed LLC ","15840 N Simmons Rd, Portland, OR 97203, USA","26-3062",1,1,NA
"Wilbur-Ellis Company ","9945 N Burgard Way, Portland, OR 97203, USA","26-3217",1,NA,NA
"Tyree Oil, Inc. ","2429 N Borthwick Ave, Portland, OR 97227, USA","26-3075",1,NA,NA
"Tata Communications (US) Inc. ","1225 W Burnside St, Portland, OR 97209, USA","26-0040",1,1,NA
"PCC Structurals LBO power generator","4600 SE Harney Dr, Portland, OR 97206, USA","26-0130",1,1,NA
"SunGard Availability Services, LP ","1233 NW 12th Ave, Portland, OR 97209, USA","26-0132",1,NA,NA
"Skyline Tower, LLC KGW","1501 SW Jefferson St, Portland, OR 97201, USA","26-0133",1,NA,NA
"Providence Health & Services - Oregon dba Providence Portland Medical Center","4805 NE Glisan St, Portland, OR 97213, USA","26-0136",1,1,NA
"City of Portland, Bureau of Environmental Services Columbia Boulevard Wastewater Treatment Plant","5001 N Columbia Blvd, Portland, OR 97203, USA","26-0172",1,1,NA
"Multnomah County East County Courthouse","18480 SE Stark St, Portland, OR 97233, USA","26-0229",1,NA,NA
"Multnomah County Facilities & Prop. Mng. ","14355 N Bybee Lake Ct, Portland, OR 97203, USA","26-0243",1,NA,1
"Multnomah County Facilities & Prop. Mng. ","1401 NE 68th Ave, Portland, OR 97213, USA","26-0244",1,NA,NA
"MEMC Electronic Materials, Inc. Portland, Oregon Manufacturing","7832 N Leadbetter Rd, Portland, OR 97217, USA","26-9536",1,1,NA
"Pratt and Larson Ceramics ","1201 SE 3rd Ave, Portland, OR 97214, USA","26-9548",1,NA,NA
"Kohler Company Ann Sacks Tile","8120 NE 33rd Dr, Portland, OR 97211, USA","26-9801",1,1,NA
"Northwest Copper Works, Inc. ","1303 N River St, Portland, OR 97227, USA","26-0168",1,NA,NA
"Sulzer Pumps (US), Inc. ","2800 NW Front Ave, Portland, OR 97210, USA","26-0178",1,1,NA
"Rikar Enterprises Inc. Pioneer Trailer and Fabrication","7559 NE 33rd Dr, Portland, OR 97211, USA","26-0179",1,NA,NA
"American Metal Products Company AMPCO","1532 SE 3rd Ave, Portland, OR 97214, USA","26-0184",1,NA,NA
"CH Murphy/Clark-Ulman, Inc. ","5565 N Dolphin St, Portland, OR 97217, USA","26-0187",1,NA,NA
"Transco Industries, Inc. ","5534 NE 122nd Ave, Portland, OR 97230, USA","26-0218",1,1,NA
"The Lynch Company, Inc. ","The Lynch Company in Portland, OR, USA, 4706 SE 18th Ave, Portland, OR 97202, USA","26-0251",1,NA,NA
"East Side Plating, Inc. Plant #4","310 SE Stephens St, Portland, OR 97214, USA","26-0171",1,1,1
"Apex Anodizing, Inc. Apex Anodizing, Inc.","7116 SE 92nd Ave, Portland, OR 97266, USA","26-0189",1,1,NA
"Bob Thomas Auto Body ","8752 NE Sandy Blvd, Portland, OR 97220, USA","26-0159",1,NA,NA
"Brasher's Auto and Truck Collision Repair ","23585 NE Sandy Blvd, Wood Village, OR 97060, USA","26-0161",1,NA,NA
"U-Haul Repair Center ","11711 SE 82nd Ave, Happy Valley, OR 97086, USA","26-0164",1,NA,NA
"K W Auto Body, Inc. dba Si's Auto Body","6708 NE Glisan St, Portland, OR 97213, USA","26-0165",1,NA,NA
"Columbia Sales and Service, Inc. ","8500 N Columbia Blvd, Portland, OR 97203, USA","26-0173",1,NA,NA
"Sharp Auto Body and Paint Works, Inc. ","4031 SE 26th Ave, Portland, OR 97202, USA","26-0174",1,NA,NA
"Gateway Body Shop, Inc. ","1418 NE 119th Ave, Portland, OR 97220, USA","26-0175",1,NA,NA
"Tom Black's Garage ","2400 NE Holladay St, Portland, OR 97232, USA","26-0185",1,NA,NA
"East Portland Auto Body, Inc. ","9127 SE Stark St, Portland, OR 97216, USA","26-0186",1,NA,NA
"Central Auto Body LLC dba John's Landing Auto Body","6805 SW Macadam Ave, Portland, OR 97219, USA","26-0188",1,NA,NA
"Jose Sanchez Jose's Auto Body","10510 SE Reedway St, Portland, OR 97266, USA","26-0191",1,NA,NA
"Thompson Auto Body, Inc. ","10310 SE Foster Rd, Portland, OR 97266, USA","26-0194",1,NA,NA
"ACP Auto Body LLC ","10033 E Burnside St, Portland, OR 97216, USA","26-0196",1,NA,NA
"Express Auto Body, Inc. ","801 N Lombard St, Portland, OR 97217, USA","26-0205",1,NA,NA
"Fix Auto Express Gresham ","1300 NE Division St, Gresham, OR 97030, USA","26-0209",1,NA,NA
"ACME Welding, Inc. ","Industrial Building in OR, USA, 637 SE Salmon St, Portland, OR 97214, USA","26-0211",1,NA,NA
"Portland Auto LLC ","10000 SE Ankeny St, Portland, OR 97216, USA","26-0212",1,NA,NA
"Elite Collision LLC ","1925 Powell Blvd, Gresham, OR 97080, USA","26-0216",1,NA,NA
"Quality Industrial Refinishers Co. ","901 NE Gertz Rd, Portland, OR 97211, USA","26-0217",1,NA,NA
"Vanquish Investment Group Pacific Service Center","4030 NE Buffalo St, Portland, OR 97211, USA","26-0219",1,NA,NA
"Horizon Air Industries ","8070 NE Airtrans Way, Portland, OR 97218, USA","26-0248",1,NA,NA
"Manheim Portland Manheim","3000 N Hayden Island Dr, Portland, OR 97217, USA","26-9546",1,NA,NA
"Timby's Too LLC Timby's Dipstrip","7510 N Delaware Ave, Portland, OR 97217, USA","26-0232",1,NA,NA
"Aarons Custom Metal Fab, Inc. ","4709 NE 148th Ave, Portland, OR 97230, USA","26-0167",1,NA,NA
"Metal Enterprises, Inc. ","2425 NW 23rd Pl, Portland, OR 97210, USA","26-0197",1,NA,NA
"EVRAZ Inc, NA ","14400 N Rivergate Blvd, Portland, OR 97203, USA","26-1865",1,1,1
"Owens-Brockway Glass Container Inc. ","9710 NE Glass Plant Rd, Portland, OR 97220, USA","26-1876",1,1,1
"Arc Terminals Holdings, LLC Willbridge Asphalt Refinery","5501 NW Front Ave, Portland, OR 97210, USA","26-2025",1,1,1
"Chevron Products Company ","5531 NW Doane Ave, Portland, OR 97210, USA","26-2027",1,NA,NA
"Kinder Morgan Liquids Terminals LLC Willbridge Terminal","5880 NW St Helens Rd, Portland, OR 97210, USA","26-2028",1,NA,1
"Shore Terminals LLC Nustar","9420 NW St Helens Rd, Portland, OR 97231, USA","26-2029",1,NA,1
"BP West Coast Products, LLC ","9930 NW St Helens Rd, Portland, OR 97231, USA","26-2030",1,NA,1
"Oregon Health Sciences University ","3181 SW Sam Jackson Park Rd, Portland, OR 97239, USA","26-2050",1,1,1
"ESCO Corporation ","2141 NW 25th Ave, Portland, OR 97210, USA","26-2068",1,1,1
"Daimler Trucks North America, LLC Western Star Truck Plant Portland","6936 N Fathom St, Portland, OR 97217, USA","26-2197",1,1,1
"Northwest Pipe Company ","12005 N Burgard Way, Portland, OR 97203, USA","26-2492",1,NA,1
"Graphic Packaging International, Inc ","3400 N Marine Dr, Portland, OR 97217, USA","26-2777",1,1,1
"Gunderson LLC ","4700 NW Front Ave, Portland, OR 97210, USA","26-2944",1,NA,1
"Arclin Surfaces, Inc. Portland Operations","2301 N Columbia Blvd, Portland, OR 97217, USA","26-3009",1,1,1
"Owens Corning Roofing and Asphalt, LLC ","11910 NW St Helens Rd, Portland, OR 97231, USA","26-3067",1,1,1
"Vigor Industrial, LLC ","5555 N Channel Ave BLDG 71, Portland, OR 97217, USA","26-3224",1,1,1
"Metropolitan Service District St Johns Landfill","9363 N Columbia Blvd, Portland, OR 97203, USA","26-3310",1,NA,1
"Owens Corning Foam Insulation, LLC Owens Corning-Gresham Plant","18456 NE Wilkes Rd, Portland, OR 97230, USA","26-9537",1,1,NA
"Rodda Paint Co. ","6123 N Marine Dr, Portland, OR 97203, USA","26-0026",1,1,1
"SemiConductor Components Industries, LLC ON Semiconductor","23400 NE Glisan St, Gresham, OR 97030, USA","26-0027",1,1,1
"Columbia Structural Tubing Inc. Evraz Oregon Steel Structural Tubing","8735 N Harborgate St, Portland, OR 97203, USA","26-0054",1,NA,NA
"City of Portland,Bureau of Environmental Columbia Blvd WWTP","5001 N Columbia Blvd, Portland, OR 97203, USA","26-0100",1,1,1
"Bushwacker, Inc. ","9269 N Bradford St, Portland, OR 97203, USA","26-0123",1,NA,NA
"Waste Management of Oregon, Inc. WM Agilyx Wastech","701 N Hunt St, Portland, OR 97217, USA","26-0170",1,NA,NA
"Troutdale Energy Center LLC Troutdale Energy Center","Troutdale, OR 97060, USA","26-0235",1,NA,NA
"Solenis LLC ","3366 NW Yeon Ave, Portland, OR 97210, USA","26-1814",1,1,NA
"Owens Corning Roofing and Asphalt, LLC Trumbull Asphalt","3750 NW Yeon Ave, Portland, OR 97210, USA","26-1815",1,NA,1
"PCC Structurals, Inc. ","4600 SE Harney Dr, Portland, OR 97206, USA","26-1867",1,1,NA
"Columbia Steel Casting Co Inc. ","10425 N Bloss Ave, Portland, OR 97203, USA","26-1869",1,1,1
"J. R. Simplot Company Rivergate Terminal","14003 N Rivergate Blvd, Portland, OR 97203, USA","26-1889",1,NA,1
"Ash Grove Cement Company ","13939 N Rivergate Blvd, Portland, OR 97203, USA","26-1891",1,1,NA
"R. R. Donnelley Norwest, Inc. ","17401 NE Halsey St, Portland, OR 97230, USA","26-1892",1,1,NA
"Herbert Malarkey Roofing Company ","3131 N Columbia Blvd, Portland, OR 97217, USA","26-1894",1,1,1
"LD Commodities, Northwest Facility, LLC O'Dock - Facility","900 N Thunderbird Way, Portland, OR 97227, USA","26-2000",1,NA,NA
"Temco, LLC A Limited Liability Company of Delaware ","800 N River St, Portland, OR 97227, USA","26-2003",1,NA,NA
"Phillips 66 Company Phillips 66 Portland Terminal","5528 NW Doane Ave, Portland, OR 97210, USA","26-2026",1,NA,1
"CertainTeed Corporation ","6350 NW Front Ave, Portland, OR 97210, USA","26-2043",1,1,1
"Boeing Company (The) ","19000 NE Sandy Blvd, Portland, OR 97230, USA","26-2204",1,1,1
"Equilon Enterprises LLC dba Shell Oil Products US","3800 NW St Helens Rd, Portland, OR 97210, USA","26-2478",1,NA,1
"Container Management Services, LLC ","3000 NW St Helens Rd, Portland, OR 97210, USA","26-2572",1,NA,1
"Columbia Export Terminal, LLC ","15660 N Lombard St, Portland, OR 97203, USA","26-2807",1,NA,NA
"Kinder Morgan Bulk Terminals, Inc. Terminal 4 - Pier 4","11040 N Lombard St, Portland, OR 97203, USA","26-2909",1,1,NA
"Port Of Portland Portland Intl Airport","7320 NE Airport Way, Portland, OR 97218, USA","26-2914",1,1,1
"Cenveo Corporation Graphic Arts Center","2000 NW Wilson St, Portland, OR 97209, USA","26-2931",1,1,NA
"United States Bakery Franz Bakery Portland","340 NE 11th Ave, Portland, OR 97232, USA","26-2952",1,NA,1
"Mondelez Global LLC ","100 NE Columbia Blvd, Portland, OR 97211, USA","26-2968",1,1,1
"Siltronic Corporation ","7200 NW Front Ave, Portland, OR 97210, USA","26-3002",1,1,1
"American Petroleum Environmental Services, Inc. ","11535 N Force Ave, Portland, OR 97217, USA","26-3021",1,NA,NA
"Myers Containers, LLC ","8435 NE Killingsworth St, Portland, OR 97220, USA","26-3035",1,NA,NA
"Cascade Corporation ","2201 NE 201st Ave, Portland, OR 97230, USA","26-3038",1,1,1
"Oregonian Publishing Co. ","1621 SW Taylor St, Portland, OR 97205, USA","26-3045",1,1,NA
"Oil Re-Refining Company Inc. ","4150 N Suttle Rd, Portland, OR 97217, USA","26-3048",1,NA,1
"QG Printing II Corp. ","6031 NE 92nd Dr, Portland, OR 97220, USA","26-3110",1,1,NA
"Bullseye Glass Co. ","3722 SE 21st Ave, Portland, OR 97202, USA","26-3135",1,1,1
"Microchip Technology, Inc. ","21015 SE Stark St, Gresham, OR 97030, USA","26-3240",1,1,1
"Sapa, Inc. ","5325 NE Skyport Way, Portland, OR 97218, USA","26-3241",1,1,1
"Oregon Air National Guard ","6801 NE Cornfoot Rd, Portland, OR 97218, USA","26-3254",1,1,1
"Boeing Company Boeing PDX","4635 NE Cornfoot Rd, Portland, OR 97218, USA","26-3291",1,NA,1
"Canron Western Constructors, Inc. ","4600 NE 138th Ave, Portland, OR 97230, USA","26-3311",1,NA,1
"Silver Eagle Manufacturing Co. ","5825 NE Skyport Way, Portland, OR 97218, USA","26-3317",1,1,1
"CBG Portland, LLC ","6849 NE Columbia Blvd, Portland, OR 97218, USA","26-9820",1,NA,NA
"Flint Group North America Flint Ink","2985 N Marine Dr, Portland, OR 97217, USA","26-0076",1,1,1
"Mutual Materials Company ","2300 SE Hogan Rd, Gresham, OR 97080, USA","26-0088",1,1,1
"Journal Graphics, Inc. ","joumal Graphics in Portland, OR, USA, 2840 NW 35th Ave, Portland, OR 97210, USA","26-0103",1,1,NA
"Pierce Pacific Manufacturing ","4424 NE 158th Ave, Portland, OR 97230, USA","26-0143",1,1,1
"Ash Grove Cement Company Cement Distribution Ctr","3737 N Port Center Way, Portland, OR 97217, USA","26-0146",1,NA,NA
"EZFlow, Limited Partnership ","3004 N Wygant St, Portland, OR 97217, USA","26-0157",1,NA,1
"SoloPower, Inc. ","6308 N Marine Dr, Portland, OR 97203, USA","26-0207",1,NA,NA
"Morgan Truck Body LLC Morgan Corporation","4436 NE 158th Ave, Portland, OR 97230, USA","26-0236",1,NA,NA
"Rose City Printing and Publishing, Inc. Rose City Printing and Packaging","18683 NE Sandy Blvd, Portland, OR 97230, USA","26-0238",1,NA,NA
"Glass to Glass LLC ECOI","866 N Columbia Blvd, Portland, OR 97217, USA","26-0242",1,NA,NA
"Galvanizers Company ","2406 NW 30th Ave, Portland, OR 97210, USA","26-1885",1,1,1
"Supreme Perlite Company ","4600 N Suttle Rd, Portland, OR 97217, USA","26-2390",1,NA,1
"Cardinal Aluminum ","6800 NE 59th Pl, Portland, OR 97218, USA","26-2435",1,1,NA
"Eco Services Operations, LLC ","4429 N Suttle Rd, Portland, OR 97217, USA","26-2548",1,1,NA
"Portland State University Fourth Avenue Building","1900 SW 4th Ave, Portland, OR 97201, USA","26-2832",1,NA,1
"Koppers, Inc. ","7540 NW St Helens Rd, Portland, OR 97210, USA","26-2930",1,1,NA
"Ross Island Sand & Gravel Co. Tait Dry Mix & Redimix Plant","2611 SE 4th Ave, Portland, OR 97202, USA","26-3006",1,1,NA
"International Paper Company ","1601 NE 192nd Ave, Portland, OR 97230, USA","26-3051",1,1,1
"SSA Pacific, Inc. Portland BulkTerminal 5","15550 N Lombard St, Portland, OR 97203, USA","26-3071",1,NA,NA
"Olympic Pipe Line Co. Portland Delivery Facilit","9420 NW St Helens Rd, Portland, OR 97231, USA","26-3072",1,NA,NA
"RUSCO, Inc Dura Industries","4466 NW Yeon Ave, Portland, OR 97210, USA","26-3112",1,1,NA
"City Of Gresham Wastewater Treatment Plnt","20015 NE Sandy Blvd, Portland, OR 97230, USA","26-3228",1,1,1
"Lacamas Laboratories ","3625 N Suttle Rd, Portland, OR 97217, USA","26-3230",1,1,1
"Hickory Springs Of California, LLC HSM Solutions","3900 NE 158th Ave, Portland, OR 97230, USA","26-3266",1,1,NA
"US Bancorp ","17650 NE Sandy Blvd, Portland, OR 97230, USA","26-3267",1,NA,1
"Oldcastle Building Products Inc. Central Premix Concrete Products Inc.","1402 N River St, Portland, OR 97227, USA","26-3272",1,1,1
"Portland General Electric Company Portland Service Center","3700 SE 17th Ave, Portland, OR 97202, USA","26-9550",1,1,1
"Signature Graphics, Inc. ","15040 NE Mason St, Portland, OR 97230, USA","26-9554",1,NA,1
"RB Recycling ","8501 N Borthwick Ave, Portland, OR 97217, USA","26-9818",1,NA,NA
"Millbank Materials USA Ltd Tenex Management Ltd","15540 N Lombard St, Portland, OR 97203, USA","26-0249",1,NA,NA
"AjinomotoWindsor, Inc. ","7124 N Marine Dr, Portland, OR 97203, USA","26-3293",1,1,NA
"Harris Soup Company, an Oregon Corporation Harris Soup Company","17711 NE Riverside Pkwy, Portland, OR 97230, USA","26-9534",1,NA,NA
"The Sherwin Williams Company Purdy Corporation","13201 N Lombard St, Portland, OR 97203, USA","26-9542",1,1,NA
"Multnomah County School Dist.1 Madison High School","2735 NE 82nd Ave, Portland, OR 97220, USA","26-9553",1,NA,NA
"East Side Plating, Inc. Plant #5","1300 SE 2nd Ave, Portland, OR 97214, USA","26-0018",1,1,1
"Electro-Chem Metal Finishing, Inc. ","4849 SE 26th Ave, Portland, OR 97202, USA","26-0065",1,1,NA
"U.S. Dept. Of Veterans Affairs ","3710 SW US Veterans Hospital Rd, Portland, OR 97239, USA","26-2955",1,1,NA
"Alpenrose Dairy, Inc. ","6149 SW Shattuck Rd, Portland, OR 97221, USA","26-2771",1,1,NA
"East Side Plating, Inc. Plant #1, 2 and 3","8400 SE 26th Pl, Portland, OR 97202, USA","26-3036",1,1,1
"Collision Rebuilders, Inc. ","2077 NW Marshall St, Portland, OR 97209, USA","26-0192",1,NA,NA
"Mr. Formal, Inc. ","Mr Formal in Portland, OR, USA, 1205 SE Grand Ave, Portland, OR 97214, USA","26-0204",1,NA,NA
"Rogers Northwest, Inc. ","21455 SW 120th Ave, Tualatin, OR 97062, USA","34-2636",1,1,NA
"Baker Rock Resources ","21880 SW Farmington Rd, Beaverton, OR 97007, USA","34-2637",1,1,NA
"Van Doren Red-E-Mix, Inc. ","1910 26th Ave, Forest Grove, OR 97116, USA","34-2034",1,NA,NA
"Pacific Rock Products, LLC Tualatin Plant","18610 SW Pacific Dr, Sherwood, OR 97140, USA","34-2583",1,NA,NA
"Wilsonville Concrete Products Beaverton Site","6700 SW 110th Ave, Beaverton, OR 97008, USA","34-2640",1,1,NA
"Baker Rock Resources ","21880 SW Farmington Rd, Beaverton, OR 97007, USA","34-2737",1,1,NA
"Glacier Northwest, Inc. Hillsboro Readymix","21480 NW Amberwood Dr, Hillsboro, OR 97124, USA","34-2769",1,1,NA
"Fox Lumber Sales, Inc. Fox Lumber - Gaston Operations","49800 SW Scoggins Valley Rd, Gaston, OR 97119, USA","34-0104",1,1,NA
"Banks Lumber Co. ","42060 NW Sunset Ave, Banks, OR 97106, USA","34-2565",1,NA,NA
"Woodfold Mfg., Inc. ","1811 18th Ave, Forest Grove, OR 97116, USA","34-2584",1,1,NA
"Oregon-Canadian Forest Products, Inc. ","31450 NW Commercial St, North Plains, OR 97133, USA","34-2688",1,NA,NA
"Suburban Door Co., Inc. ","12365 SW Herman Rd, Tualatin, OR 97062, USA","34-2792",1,1,NA
"Peterkort Roses, L.L.C. ","11815 SW Hillsboro Hwy, Hillsboro, OR 97123, USA","34-0001",1,NA,NA
"Providence St. Vincent Medical Center ","9205 SW Barnes Rd, Portland, OR 97225, USA","34-2585",1,1,NA
"Portland Community College Rock Creek Campus","17705 NW Springville Rd, Portland, OR 97229, USA","34-2639",1,1,NA
"Oregon Roses, Inc. Plant F","1804 NW Martin Rd, Forest Grove, OR 97116, USA","34-2641",1,NA,NA
"Tuality Community Hospital ","335 SE 8th Ave, Hillsboro, OR 97123, USA","34-2759",1,NA,NA
"Cascade Funeral Directors ","8974 SW Tualatin-Sherwood Rd, Tualatin, OR 97062, USA","34-0048",1,NA,NA
"Springer & Son, Inc. Aloha Funeral Home","4150 SW 185th Ave, Beaverton, OR 97007, USA","34-0070",1,NA,NA
"Finley-Sunset Hills Mortuary Sunset Hills Mortuary","6801 SW Sunset Hwy, Portland, OR 97225, USA","34-0090",1,NA,NA
"Washington County Dog Control ","1901 SE 24th Ave, Hillsboro, OR 97123, USA","34-2630",1,NA,NA
"Fulton, Rose & Hoyt Funeral Home ","2308 SW Pacific Ave, Forest Grove, OR 97116, USA","34-9691",1,NA,NA
"Jewett-Cameron Seed Company ","31345 NW Beach Rd, Hillsboro, OR 97124, USA","34-2510",1,NA,NA
"Tata Communications (US) Inc. ","21101 NW Evergreen Pkwy, Hillsboro, OR 97124, USA","34-0022",1,NA,NA
"TriQuint Semiconductor, Inc. Electric Generator","2300 NE Brookwood Pkwy, Hillsboro, OR 97124, USA","34-0080",1,1,NA
"Viawest , Inc. ","3935 Aloclek Pl, Hillsboro, OR 97124, USA","34-0083",1,NA,NA
"Clean Water Services Dawson Creek Pump Station","SW CORNER OF NE CORNELL & BROOKWOOD PKWY, HILLSBORO, OR 97124","34-0096",1,1,NA
"Kaiser Foundation Health Plan of the Northwest dba Kaiser Permanente Kaiser Westside Medical Center","19301 NW Venetian Dr, Hillsboro, OR 97124, USA","34-0133",1,NA,NA
"Clean Water Services ","9835 NW 307th Ave, North Plains, OR 97133, USA","34-0139",1,NA,NA
"City of Hillsboro Water Dept","30575 NW Evergreen Rd, Hillsboro, OR 97124, USA","34-0142",1,NA,NA
"City of Hillsboro Hillsboro WWTP","4475 SW Fern Hill Rd, Forest Grove, OR 97116, USA","34-0164",1,1,NA
"ViaWest, Inc. ","23605 NE Huffman St, Hillsboro, OR 97124, USA","34-0165",1,NA,NA
"SolarWorld Industries America LP ","25300 NW Evergreen Rd, Hillsboro, OR 97124, USA","34-9508",1,1,NA
"Helser Industries, Inc. ","10750 SW Tualatin Rd, Tualatin, OR 97062, USA","34-0003",1,NA,NA
"McClister, Inc. Lifetime Gate Co.","18155 SW Teton Ave, Tualatin, OR 97062, USA","34-0102",1,NA,NA
"Ammcon Corp. ","21450 NW West Union Rd, Hillsboro, OR 97124, USA","34-0113",1,1,NA
"Jewell Attachments, LLC ","18135 SW Boones Ferry Rd, Portland, OR 97224, USA","34-0130",1,1,NA
"Westak of Oregon, Inc. Westak of Oregon","3941 24th Ave, Forest Grove, OR 97116, USA","34-0097",1,1,NA
"Pioneer Metal Finishing Superior Metal Finishing","18240 SW 100th Ct, Tualatin, OR 97062, USA","34-0099",1,1,NA
"Pioneer Metal Finishing, LLC Pioneer Metal Finishing, LLC","19005 SW 125th Ct, Tualatin, OR 97062, USA","34-0107",1,1,1
"Copper Knot Metal Finishing LLC ","1184 N Fremont Ln, Cornelius, OR 97113, USA","34-0156",1,NA,NA
"Anodizing Solutions, LLC ","12620 SW Leveton Dr, Tualatin, OR 97062, USA","34-0166",1,NA,NA
"Pacific Truck Colors, Inc. ","19225 SW 125th Ct, Tualatin, OR 97062, USA","34-0015",1,NA,NA
"Landmark Ford, Inc. ","12000 SW 66th Ave, Tigard, OR 97223, USA","34-0101",1,NA,NA
